projectid_head,projectid,projectname,countryname,projectmodality,status,approvalno,approvaldate,sector1,sector1a,safe_env,safe_ind,safe_res
46416,46416-002,Power Transmission Rehabilitation Project,Armenia,Loan,Closed,3150,7/31/14,Energy,Electricity transmission and distribution ,B,C,C
46417,46417-001,Jaipur Metro Rail Line 1-Phase B Project,India,Loan,Closed,3062,11/20/13,Transportation,Urban public transport,A,C,C
46443,46443-002,Second Greater Mekong Subregion Corridor Towns Development Project,Cambodia,Loan,Closed,3314,11/13/15,Water,Urban flood protection ,B,C,B
46543,46543-002,Central Asia Regional Economic Cooperation Corridors 3 and 5 Enhancement Project,Tajikistan,Grant,Closed,356,9/19/13,Transportation,Road transport (non-urban),B,C,B
47017,47017-003,Wholesale Metering and Transmission Reinforcement Project,Tajikistan,Grant,Closed,417,12/2/14,Energy,Electricity transmission and distribution ,B,C,B
47085,47085-002,Road Sector Governance and Maintenance Project,Lao People's Democratic Republic,Loan,Closed,3368,1/28/16,Transportation,Road transport (non-urban),B,B,C
47100,47100-004,Madhya Pradesh Power Transmission and Distribution System Improvement Project,India,Loan,Closed,3066,11/27/13,Energy,Electricity transmission and distribution,B,C,B
47101,47101-002,Assam Power Sector Investment Program - Tranche 1,India,Loan,Closed,3140,7/11/14,Energy,Conventional energy generation,B,C,C
47101,47101-003,Assam Power Sector Investment Program - Tranche 2,India,Loan,Closed,3327,11/23/15,Energy,Electricity transmission and distribution ,B,C,B
47182,47182-001,Southern Road Connectivity Project,Sri Lanka,Loan,Closed,3027 | 3028,9/23/13,Transportation,Road transport (non-urban),B,C,A
47270,47270-001,Madhya Pradesh District Connectivity Sector Project,India,Loan,Closed,3189,11/19/14,Transportation,Road transport (non-urban),B,C,B
47273,47273-003,Integrated Road Investment Program-Tranche 1,Sri Lanka,Loan,Closed,3171,10/3/14,Transportation,Road transport (non-urban),B,C,B
47273,47273-004,Integrated Road Investment Program-Tranche 2,Sri Lanka,Loan,Closed,3221 | 3222,12/11/14,Transportation,Road transport (non-urban),B,C,B
47273,47273-005,Integrated Road Investment Program-Tranche 3,Sri Lanka,Loan,Closed,3325 | 3326,11/23/15,Transportation,Road transport (non-urban),B,C,B
47281,47281-001,National Highway Network Development in Balochistan Project,Pakistan,Grant | Loan,Closed,0451 | 3134,6/27/14,Transportation,Road transport (non-urban),B,C,B
47341,47341-002,South Asia Subregional Economic Cooperation Road Connectivity Investment Program - Tranche 1,India,Loan,Closed,3118,4/1/14,Transportation,Road transport (non-urban),A,A,A
47341,47341-003,South Asia Subregional Economic Cooperation Road Connectivity Investment Program-Tranche 2,India,Loan,Closed,3690,8/13/18,Transportation,Road transport (non-urban),B,B,A
48023,48023-003,Ningxia Liupanshan Poverty Reduction Rural Road Development Project,China,Loan,Closed,3444,10/21/16,Transportation,Road transport (non-urban),B,B,B
48226,48226-003,Second Rural Connectivity Investment Program - Tranche 1,India,Loan,Closed,3611,12/4/17,Transportation,Road transport (non-urban),B,C,C
48226,48226-004,Second Rural Connectivity Investment Program - Tranche 2,India,Loan,Closed,3703,9/12/18,Transportation,Road transport (non-urban),B,C,C
48293,48293-001,Transport Sector Flood Recovery Project,Solomon Islands,Grant | Loan,Closed,0403 | 3152,8/13/14,Transportation,Road transport (non-urban),B,C,B
48402,48402-001,National Motorway M-4 Gojra–Shorkot Section Project,Pakistan,Grant | Loan,Closed,0440 | 0482 | 3300 | 3395 | 8308,9/30/15,Transportation,Road transport (non-urban),A,C,A
48424,48424-002,CAREC Corridors 1 and 6 Connector Road (Aktobe–Makat) Reconstruction Project,Kazakhstan,Loan,Closed,3416,8/26/16,Transportation,Road transport (non-urban),B,C,B
49080,49080-001,Electricity Grid Strengthening—Sumatra Program,Indonesia,Loan,Closed,3339 | 8297,12/2/15,Energy,Electricity transmission and distribution,B,C,B
49094,49094-001,Railway Rolling Stock Project,Bangladesh,Loan,Closed,3301,9/30/15,Transportation,Rail transport (non-urban),C,C,C
49113,49113-001,Managing Soil Pollution in Ger Areas through Improved On-site Sanitation Project,Mongolia,Grant,Closed,9189,11/10/16,Water,,C,C,C
49125,49125-001,Second Jharkhand State Road Project,India,Loan,Closed,3276,9/9/15,Transportation,Road transport (non-urban) ,B,C,A
49191,49191-001,Post-Flood National Highways Rehabilitation Project,Pakistan,Loan,Closed,3378,3/29/16,Transportation,Road transport (non-urban),B,C,B
49214,49214-002,Solar Transmission Sector Project,India,Loan,Closed,3521 | 8325,3/29/17,Energy,Electricity transmission and distribution,B,C,B
49228,49228-002,Rajasthan State Highway Investment Program - Tranche 1,India,Loan,Closed,3534,5/30/17,Transportation,Road transport (non-urban),B,C,A
49319,49319-001,Cyclone Pam Road Reconstruction Project,Vanuatu,Grant | Loan,Closed,0459 | 0460 | 0461 | 0540 | 3331 | 3332 | 3552,11/25/15,Transportation,Road transport (non-urban) ,B,C,B
49377,49377-001,Madhya Pradesh District Roads II Sector Project,India,Loan,Closed,3437,9/30/16,Transportation,Road transport (non-urban) ,B,C,B
50016,50016-001,Sustainable Energy Access in Eastern Indonesia-Electricity Grid Development Program,Indonesia,Loan,Closed,3560,9/14/17,Energy,Electricity transmission and distribution,B,B,B
50063,50063-001,Kashkadarya Regional Road Project,Uzbekistan,Loan,Closed,3481,12/5/16,Transportation,Road transport (non-urban),B,C,B
50301,50301-002,Second Integrated Road Investment Program-Tranche 1,Sri Lanka,Loan,Closed,3579 | 3580,10/6/17,Transportation,Road transport (non-urban),B,C,B
50301,50301-003,Second Integrated Road Investment Program-Tranche 2,Sri Lanka,Loan,Closed,3851,11/5/19,Transportation,Road transport (non-urban),B,C,B
50372,50372-001,Water Supply Scheme for Tete Settlement,Papua New Guinea,Grant,Closed,638,2/21/19,Water,Urban water supply,B,C,C
50373,50373-002,Rooftop Solar Power Generation Project,Sri Lanka,Loan | Technical Assistance,Closed,3571 | 9389,9/26/17,Energy,Renewable energy generation - solar,C,C,C
51052,51052-002,Railway Efficiency Improvement Project,Uzbekistan,Loan,Closed,3785,5/20/19,Transportation,Rail transport (non-urban),C,C,C
51180,51180-001,Bihar State Highways III Project,India,Loan,Closed,3738,11/15/18,Transportation,Road transport (non-urban) ,B,C,A
51297,51297-001,Urban Project Preparatory Facility,Sri Lanka,Loan | Technical Assistance,Closed,3706 | 9590,9/18/18,Transportation,Urban roads and traffic management ,C,C,C
52129,52129-001,Cyclone Gita Recovery Project,Tonga,Grant,Closed,575,6/15/18,Energy,Electricity transmission and distribution,B,C,C
52256,52256-006,Osh-Plotina Water Treatment Plant Chlorine Neutralization Unit,Kyrgyz Republic,Grant,Closed,704,8/17/20,Water,Urban water supply,B,C,C
52303,52303-001,Managing Solid Waste in Secondary Cities,Mongolia,Grant,Closed,9206,6/8/20,Water,Urban solid waste management,B,C,C
55154,55154-001,Strengthening Multimodal and Integrated Logistics Ecosystem Program (Subprogram 1),India,Loan,Closed,4275,12/8/22,Transportation,Multimodal logistics,C,C,C